{
  "schemaVersion": 1,
  "environment": "production",
  "operator": "release-operator",
  "productionReleaseConfig": "/secure-input/hermes-go/production-release.json",
  "host": {
    "hostname": "gateway-prod",
    "architecture": "amd64"
  },
  "gateway": {
    "origin": "https://gateway.example.com",
    "runtimeContract": "hermes-serve-v1"
  },
  "secrets": {
    "fcmServiceAccountSource": "/secure-input/hermes-go/fcm-service-account.json"
  },
  "push": {
    "firebaseProjectId": "hermesgo-94bbc"
  },
  "deployment": {
    "observationSeconds": 30
  }
}
